### ISSUE TITLE
docker-machine cannot open an outgoing socket to api.github.com resolver behaves as if a response was not received.

### ISSUE THREAD

**Issue by fayep** [docker/machine#1695]
```
faye.salwin:~/Sources/docker_projects/grub $ docker-machine rm dev; sudo tcpdump -i en0 host api.github.com or port 53 & sleep 1; docker-machine -D create -d vmwarefusion dev; fg
Deleting dev...
Successfully removed dev
[2] 49325
tcpdump: verbose output suppressed, use -v or -vv for full protocol decode
listening on en0, link-type EN10MB (Ethernet), capture size 65535 bytes
No default boot2docker iso found locally, downloading the latest release...
11:20:49.549866 IP 192.168.15.40.49962 > 192.168.15.1.domain: 43713+ A? api.github.com. (32)
11:20:49.549952 IP 192.168.15.40.56073 > 192.168.15.1.domain: 55473+ AAAA? api.github.com. (32)
11:20:49.555967 IP 192.168.15.1.domain > 192.168.15.40.49962: 43713 1/0/0 A 192.30.252.137 (48)
11:20:49.556634 IP 192.168.15.1.domain > 192.168.15.40.56073: 55473 0/0/0 (32)
11:20:49.556854 IP 192.168.15.40.54597 > 192.168.15.1.domain: 31935+ AAAA? api.github.com.va.opower.it. (45)
11:20:49.558137 IP 192.168.15.1.domain > 192.168.15.40.54597: 31935 NXDomain* 0/0/0 (45)
11:20:49.558383 IP 192.168.15.40.49392 > 192.168.15.1.domain: 11320+ AAAA? api.github.com.ca.opower.it. (45)
11:20:49.559517 IP 192.168.15.1.domain > 192.168.15.40.49392: 11320 NXDomain* 0/0/0 (45)
11:20:49.559669 IP 192.168.15.40.49520 > 192.168.15.1.domain: 56970+ AAAA? api.github.com.local. (38)
11:20:49.584861 IP 192.168.15.40.51396 > 192.168.15.1.domain: 10698+ PTR? 40.15.168.192.in-addr.arpa. (44)
11:20:49.586573 IP 192.168.15.1.domain > 192.168.15.40.51396: 10698 NXDomain* 0/0/0 (44)
11:20:49.587532 IP 192.168.15.40.57544 > 192.168.15.1.domain: 34323+ PTR? 1.15.168.192.in-addr.arpa. (43)
11:20:49.590046 IP 192.168.15.1.domain > 192.168.15.40.57544: 34323 NXDomain* 0/0/0 (43)
11:20:50.147101 IP 192.168.15.40.51450 > 192.168.15.1.domain: 56999+ A? wildcard-talkgadget.l.google.com. (50)
11:20:50.164123 IP 192.168.15.1.domain > 192.168.15.40.51450: 56999 1/0/0 A 74.125.28.189 (66)
Error creating machine: Get https://api.github.com/repos/boot2docker/boot2docker/releases: dial tcp: i/o timeout
You will want to check the provider to make sure the machine and associated resources were properly removed.
sudo tcpdump -i en0 host api.github.com or port 53
^C
15 packets captured
108 packets received by filter
0 packets dropped by kernel
faye.salwin:~/Sources/docker_projects/grub $ dig any api.github.com.

; <<>> DiG 9.8.3-P1 <<>> any api.github.com.
;; global options: +cmd
;; Got answer:
;; ->>HEADER<<- opcode: QUERY, status: NOERROR, id: 40016
;; flags: qr rd ra; QUERY: 1, ANSWER: 1, AUTHORITY: 0, ADDITIONAL: 0

;; QUESTION SECTION:
;api.github.com.			IN	ANY

;; ANSWER SECTION:
api.github.com.		19	IN	A	192.30.252.136

;; Query time: 25 msec
;; SERVER: 192.168.15.1#53(192.168.15.1)
;; WHEN: Thu Aug 13 11:21:21 2015
;; MSG SIZE  rcvd: 48
```

**Comment by fayep** [comment]
I suspect that the resolver puts the query out to IPv6 and stops waiting for the IPv4 result.

**Comment by nathanleclaire** [comment]
Ah nice, thanks for the detail.  We'll take a look.  cc @ehazlett

**Comment by fayep** [comment]
```
faye.salwin:~/Sources/go/src/local/t $ cat test.go 
package main

import "net"
import "fmt"

func main() {
        _, err := net.Dial("tcp", "api.github.com:443")
        if err != nil {
                fmt.Println(err)
        } else {
		fmt.Println("Connected OK to api.github.com:443")
	}
}
faye.salwin:~/Sources/go/src/local/t $ go run test.go
Connected OK to api.github.com:443
```

**Comment by nathanleclaire** [comment]
Hmm, very strange.

**Comment by ehazlett** [comment]
What are you system level DNS settings?

**Comment by fayep** [comment]
They point at my cable router and are resolving things just fine in general.
